{
  "schema_version": 1,
  "status": "ok",
  "request_id": "request-fork-fixture",
  "retryable": false,
  "source": {
    "server_session_id": "sess_source01",
    "native_session_id": "01980000-0000-7000-8000-000000000000",
    "version": 3,
    "artifact_sha256": "aaaaaaaaaaaaaaaaaaaaaaaaaaaaaaaaaaaaaaaaaaaaaaaaaaaaaaaaaaaaaaaa",
    "agent_type": "codex",
    "author": {
      "account_id": "acct_author01",
      "display_name": "Author"
    },
    "manifest": {
      "schema_version": 1,
      "artifact_sha256": "aaaaaaaaaaaaaaaaaaaaaaaaaaaaaaaaaaaaaaaaaaaaaaaaaaaaaaaaaaaaaaaa",
      "artifact_size": 8,
      "artifact_media_type": "application/x-ndjson",
      "manifest_sha256": "bbbbbbbbbbbbbbbbbbbbbbbbbbbbbbbbbbbbbbbbbbbbbbbbbbbbbbbbbbbbbbbb",
      "chunking_schema_version": 1,
      "chunks": [
        {
          "ordinal": 0,
          "sha256": "cccccccccccccccccccccccccccccccccccccccccccccccccccccccccccccccc",
          "raw_size": 8
        }
      ]
    },
    "git": {
      "head": "abc123",
      "branch": "main"
    },
    "lineage": {
      "root_server_session_id": "sess_source01"
    },
    "work_node_id": "work_fixture01"
  },
  "created": {
    "server_session_id": "sess_created01",
    "native_session_id": "01980000-0000-7000-8000-000000000001",
    "agent_type": "codex",
    "root_server_session_id": "sess_source01",
    "parent_server_session_id": "sess_source01",
    "parent_session_version": 3
  },
  "resume": {
    "program": "codex",
    "args": [
      "resume",
      "01980000-0000-7000-8000-000000000001"
    ],
    "display": "codex resume 01980000-0000-7000-8000-000000000001"
  },
  "environment_hints": {
    "source_git_head": "abc123",
    "source_git_branch": "main",
    "current_git_head": "def456",
    "current_git_branch": "feature/fork",
    "working_tree_dirty": true,
    "working_tree_changed": false
  }
}
